{
  "sample_id": "arvo_22430",
  "vuln_id": "OSS-Fuzz issue 22430",
  "project": {
    "id": "poppler",
    "repo": "https://anongit.freedesktop.org/git/poppler/poppler.git",
    "vulnerable_commit": "12dea6841940ce31630d60fa7c892da4597393aa",
    "fixed_commit": "ae2fa0be65833e7598ef5e31c2f419c52ec26ad5"
  },
  "classification": {
    "class": "container-overflow",
    "cwe": "CWE-125"
  },
  "bug_description": {
    "original": "Container-overflow WRITE 4 in poppler::page::text_list. Crash State: poppler::page::text_list pdf_fuzzer.cc. Sanitizer: address (ASAN). Recommended Security Severity: High.",
    "original_source": "ARVO-Meta.report.comments[0].content",
    "normalized": "In poppler::page::text_list, when the text_list_include_font flag is set, a text_box_font_info_data struct is created with glyph_to_cache_index initialized as an empty vector. The code calls reserve(word->getLength()) which allocates backing storage but leaves the vector's logical size at 0. It then iterates via a loop bounded by word->getLength() and uses operator[] to write at index j, which writes past the container's logical boundary. ASan detects this as a container-overflow WRITE of size 4. The fix replaces operator[] with push_back() so the vector's size is properly updated."
  },
  "source": {
    "file": "poppler/cpp/poppler-page.cpp",
    "function": "poppler::page::text_list",
    "line": 420,
    "code": "if (std::unique_ptr< TextWordList > word_list{output_dev->makeWordList()}) {",
    "var": "word_list",
    "description": "Materializes the text word list from the rendered PDF page content. The words' existence and glyph counts (word->getLength()) drive the loop iteration that reaches the container-overflow write.",
    "value_from": "Attacker-controlled PDF page content rendered by displayPageSlice into TextOutputDev, then extracted as text words by makeWordList",
    "trace_step": 1
  },
  "sink": {
    "file": "poppler/cpp/poppler-page.cpp",
    "function": "poppler::page::text_list",
    "line": 478,
    "code": "tb_font_info->glyph_to_cache_index[j] = -1;",
    "var": "glyph_to_cache_index",
    "description": "operator[] writes 4 bytes (int value -1) at index j in glyph_to_cache_index whose logical size is 0 (only capacity was set by reserve()), causing a container-overflow WRITE past the vector's logical end.",
    "trace_step": 5
  },
  "root_cause": {
    "file": "poppler/cpp/poppler-page.cpp",
    "function": "poppler::page::text_list",
    "line": 478,
    "code": "tb_font_info->glyph_to_cache_index[j] = -1;",
    "var": "glyph_to_cache_index",
    "description": "Uses operator[] to write to glyph_to_cache_index at index j, but the vector's size is 0 because only reserve() was called rather than resize() or push_back(). operator[] does not check or update the vector's size, resulting in a write past the container's logical boundary. The fix replaces this with push_back(-1).",
    "trace_step": 5
  },
  "tainted_value_origin": {
    "file": "poppler/cpp/poppler-page.cpp",
    "function": "poppler::page::text_list",
    "line": 420,
    "code": "if (std::unique_ptr< TextWordList > word_list{output_dev->makeWordList()}) {",
    "var": "word_list",
    "note": "Word list materialized from rendered PDF page content. word->getLength() >= 1 from attacker PDF drives the glyph iteration loop at line 463 to at least one iteration, reaching the vulnerable operator[] access at line 478."
  },
  "reachability_checkpoints": {
    "parser_admitted": {
      "file": "poppler/cpp/poppler-page.cpp",
      "function": "poppler::page::text_list",
      "line": 411,
      "description": "displayPageSlice renders the attacker-controlled PDF page content into the TextOutputDev; a valid-enough PDF page with text content is required for makeWordList to produce a non-empty word list."
    },
    "font_info_guard": {
      "file": "poppler/cpp/poppler-page.cpp",
      "function": "poppler::page::text_list",
      "line": 461,
      "description": "The guard 'if (tb_font_info && d->font_info_cache_initialized)' must be true to enter the block containing reserve() and the inner glyph loop. tb_font_info is non-null when opt_flag includes text_list_include_font (step 2), and font_info_cache_initialized is set by init_font_info_cache() at line 443."
    }
  },
  "coarse_trace": [
    {
      "step": 1,
      "file": "fuzz/pdf_fuzzer.cc",
      "function": "LLVMFuzzerTestOneInput",
      "summary": "Loads attacker-supplied PDF via load_from_raw_data, iterates pages, and calls text_list with text_list_include_font flag"
    },
    {
      "step": 2,
      "file": "poppler/cpp/poppler-page.cpp",
      "function": "poppler::page::text_list",
      "summary": "Renders page and extracts word list; creates font-info struct with empty glyph_to_cache_index vector, calls reserve() which sets capacity but not size, then iterates via word->getLength() loop and uses operator[] to write past vector size causing container-overflow WRITE of size 4"
    }
  ],
  "fine_trace": [
    {
      "step": 1,
      "file": "poppler/cpp/poppler-page.cpp",
      "function": "poppler::page::text_list",
      "line": 420,
      "var": "word_list",
      "code": "if (std::unique_ptr< TextWordList > word_list{output_dev->makeWordList()}) {",
      "note": "Materializes the text word list from the rendered PDF page. The crafted PDF contains at least one page with text, producing a non-null word_list with getLength() >= 1, so the outer word processing loop at line 423 is entered. displayPageSlice at line 411 rendered the page content into the TextOutputDev beforehand."
    },
    {
      "step": 2,
      "file": "poppler/cpp/poppler-page.cpp",
      "function": "poppler::page::text_list",
      "line": 442,
      "var": "opt_flag",
      "code": "if (opt_flag & page::text_list_include_font) {",
      "note": "The caller (pdf_fuzzer) passes text_list_include_font, so this condition is true and the font-info collection path is entered. Without this flag, the vulnerable code at line 478 is unreachable.",
      "depends_on": [
        {"on": 1, "type": "control", "via": "word_list->getLength() > 0 so outer loop at line 423 iterates"}
      ]
    },
    {
      "step": 3,
      "file": "poppler/cpp/poppler-page.cpp",
      "function": "poppler::page::text_list",
      "line": 449,
      "var": "glyph_to_cache_index",
      "code": "{}                   // std::vector<int> glyph_to_cache_index;",
      "note": "glyph_to_cache_index is aggregate-initialized as an empty std::vector<int> within the text_box_font_info_data struct (size=0, capacity=0).",
      "depends_on": [
        {"on": 2, "type": "control", "via": "opt_flag & page::text_list_include_font is true"}
      ]
    },
    {
      "step": 4,
      "file": "poppler/cpp/poppler-page.cpp",
      "function": "poppler::page::text_list",
      "line": 462,
      "var": "glyph_to_cache_index",
      "code": "tb_font_info->glyph_to_cache_index.reserve(word->getLength());",
      "note": "Calls reserve() with word->getLength(), which allocates backing storage (capacity >= word->getLength()) but does NOT change the vector's logical size, which remains 0. This creates the precondition for the container overflow: memory is physically allocated past the logical end, but the vector still reports size()=0.",
      "depends_on": [
        {"on": 1, "type": "data", "via": "word->getLength() derived from attacker-controlled PDF text content"},
        {"on": 3, "type": "data", "via": "glyph_to_cache_index vector with size=0"}
      ]
    },
    {
      "step": 5,
      "file": "poppler/cpp/poppler-page.cpp",
      "function": "poppler::page::text_list",
      "line": 478,
      "var": "glyph_to_cache_index",
      "code": "tb_font_info->glyph_to_cache_index[j] = -1;",
      "note": "Uses operator[] to write int value -1 (4 bytes) at index j=0 in glyph_to_cache_index. The loop at line 463 iterates with condition j < word->getLength(), not j < glyph_to_cache_index.size(). Since the vector's logical size is 0 (only capacity was set by reserve() at step 4), this writes past the container's logical boundary into reserved-but-uncommitted storage. ASan detects this as container-overflow WRITE of size 4. The fix replaces this statement with push_back(-1), which properly appends and increments the vector's size.",
      "depends_on": [
        {"on": 4, "type": "data", "via": "glyph_to_cache_index has capacity >= word->getLength() from reserve() but logical size remains 0"},
        {"on": 1, "type": "control", "via": "inner loop at line 463 iterates because word->getLength() >= 1"}
      ]
    }
  ],
  "sanitizer_ground_truth": {
    "detector": "address",
    "trace_format": "asan_trace",
    "sanitizer": "address",
    "crash_type": "container-overflow",
    "access_type": "WRITE",
    "access_size": 4,
    "crash_location": {
      "file": "poppler/cpp/poppler-page.cpp",
      "function": "poppler::page::text_list(int) const",
      "line": 478
    },
    "allocation_context": {
      "file": "poppler/cpp/poppler-page.cpp",
      "function": "poppler::page::text_list(int) const",
      "line": 462
    },
    "free_context": null,
    "crash_stack": [
      {"frame": 0, "function": "poppler::page::text_list(int) const", "file": "poppler/cpp/poppler-page.cpp", "line": 478},
      {"frame": 1, "function": "LLVMFuzzerTestOneInput", "file": "fuzz/pdf_fuzzer.cc", "line": 49}
    ],
    "allocation_stack": [
      {"frame": 0, "function": "operator new(unsigned long)", "file": "asan_new_delete.cpp", "line": 99},
      {"frame": 6, "function": "poppler::page::text_list(int) const", "file": "poppler/cpp/poppler-page.cpp", "line": 462},
      {"frame": 7, "function": "LLVMFuzzerTestOneInput", "file": "fuzz/pdf_fuzzer.cc", "line": 49}
    ],
    "free_stack": [],
    "patch_resolves": true,
    "cross_tool_confirmed": true,
    "reproduction_rate": 1.0,
    "flaky": false,
    "cross_validation": {
      "sink_matches_crash": true,